### ISSUE TITLE
[BUG] BUG现象描述(必填)同一个摄像头rtsp拉流成功 rtmp拉流失败

### ISSUE THREAD

**Issue by jimbocn** [ZLMediaKit/ZLMediaKit#3857]
## 现象描述
同一台海康摄像头，通过previewURLs获取到rtmp流地址通过addStreamProxy接口报错end of file，通过previewURLs获取到的rtsp流可以正常使用，但是在zlm报错的rtmp流在实测在vlc里面是可以播放的，不知道是什么原因，希望大佬指点

## 如何复现?
通过此接口添加
http://xx:8086/index/api/addStreamProxy?secret=xx&vhost=__defaultVhost__&app=live&timeout_sec=500&stream=1234567&url=rtmp://61.146.129.175:1935/live/openUrl/FviXO2k

## 相关日志或截图
![Snipaste_2024-09-04_12-57-28](https://github.com/user-attachments/assets/0ab51631-c348-469f-b67a-c08a3f90e5f0)

<details>
<summary>展开查看详细日志</summary>
<pre>

```
#详细日志粘在这里!
2024-09-04 12:20:43.153 D [MediaServer] [11853-event poller 10] RtmpPlayerImp.h:109 ~RtmpPlayerImp |
2024-09-04 12:20:43.153 D [MediaServer] [11853-event poller 10] RtmpPlayerImp.h:34 ~FlvPlayerBase |
2024-09-04 12:20:43.153 D [MediaServer] [11853-event poller 10] RtmpPlayer.cpp:30 ~RtmpPlayer |
2024-09-04 12:34:05.710 D [MediaServer] [11853-event poller 10] RtmpPlayer.cpp:70 play | 61.146.129.175:1935 live/openUrl FviXO2k
2024-09-04 12:34:23.694 W [MediaServer] [11853-event poller 10] RtmpPlayer.cpp:105 onPlayResult_l | 1 1(end of file)
2024-09-04 12:34:23.694 D [MediaServer] [11853-event poller 10] WebApi.cpp:266 http api debug |
# request:
GET /index/api/addStreamProxy?secret=UEiDs7AJzELzb5wwJnFlBOoyrShOSppo&vhost=__defaultVhost__&app=live&timeout_sec=500&stream=1234567&url=rtmp://61.146.129.175:1935/live/openUrl/FviXO2k
# header:
Accept : */*
Host : 192.168.101.36:8086
User-Agent : curl/7.29.0
# content:

# response:
{
        "code" : -1,
        "msg" : "end of file"
}


2024-09-04 12:34:23.694 D [MediaServer] [11853-event poller 10] RtmpPlayerImp.h:109 ~RtmpPlayerImp |
2024-09-04 12:34:23.694 D [MediaServer] [11853-event poller 10] RtmpPlayerImp.h:34 ~FlvPlayerBase |
2024-09-04 12:34:23.694 D [MediaServer] [11853-event poller 10] RtmpPlayer.cpp:30 ~RtmpPlayer |

```
</pre>
</details>

## 配置

<details>
<summary>展开查看详细配置</summary>
<pre>

```ini
#config.ini内容粘在这里!
```
</pre>
</details>

## 各种环境信息

* **代码提交记录/git commit hash**:
* **操作系统及版本**:
* **硬件信息**:
* **crash backtrace**:
```
#崩溃信息backtrace粘贴至此
```
* **其他需要补充的信息**:

**Comment by xiongguangjie** [comment]
你这个是rtmp服务器主动关闭的，vlc 能够播放吗？？？你抓包看看吧

**Comment by jimbocn** [comment]
可以播放的，我这个是公网地址，要如何抓包呢，不怎么懂这个
![Snipaste_2024-09-04_14-01-30](https://github.com/user-attachments/assets/7ad13017-8cd6-4f91-96c4-86c9556cf1d9)

**Comment by xiongguangjie** [comment]
> 可以播放的，我这个是公网地址，要如何抓包呢，不怎么懂这个 ![Snipaste_2024-09-04_14-01-30](https://private-user-images.githubusercontent.com/16046093/364243050-7ad13017-8cd6-4f91-96c4-86c9556cf1d9.png?jwt=eyJhbGciOiJIUzI1NiIsInR5cCI6IkpXVCJ9.eyJpc3MiOiJnaXRodWIuY29tIiwiYXVkIjoicmF3LmdpdGh1YnVzZXJjb250ZW50LmNvbSIsImtleSI6ImtleTUiLCJleHAiOjE3MjU0MzE5MDUsIm5iZiI6MTcyNTQzMTYwNSwicGF0aCI6Ii8xNjA0NjA5My8zNjQyNDMwNTAtN2FkMTMwMTctOGNkNi00ZjkxLTk2YzQtODZjOTU1NmNmMWQ5LnBuZz9YLUFtei1BbGdvcml0aG09QVdTNC1ITUFDLVNIQTI1NiZYLUFtei1DcmVkZW50aWFsPUFLSUFWQ09EWUxTQTUzUFFLNFpBJTJGMjAyNDA5MDQlMkZ1cy1lYXN0LTElMkZzMyUyRmF3czRfcmVxdWVzdCZYLUFtei1EYXRlPTIwMjQwOTA0VDA2MzMyNVomWC1BbXotRXhwaXJlcz0zMDAmWC1BbXotU2lnbmF0dXJlPTQ4MzEyNjNkY2FjZDc5MWYzMWRlODczMzgyN2VmNGM1YmRhYzQzYmVhYWU5ODBmNWQwNTAxOWU4NWIxZjg4ODQmWC1BbXotU2lnbmVkSGVhZGVycz1ob3N0JmFjdG9yX2lkPTAma2V5X2lkPTAmcmVwb19pZD0wIn0.1aqEyURGukfGp5xlwYg05yzGfafnp5PHJl6Any5evVo)

我用vlc无法播放

**Comment by jimbocn** [comment]
> 你这个是rtmp服务器主动关闭的，vlc 能够播放吗？？？你抓包看看吧



> > 可以播放的，我这个是公网地址，要如何抓包呢，不怎么懂这个 ![Snipaste_2024-09-04_14-01-30](https://private-user-images.githubusercontent.com/16046093/364243050-7ad13017-8cd6-4f91-96c4-86c9556cf1d9.png?jwt=eyJhbGciOiJIUzI1NiIsInR5cCI6IkpXVCJ9.eyJpc3MiOiJnaXRodWIuY29tIiwiYXVkIjoicmF3LmdpdGh1YnVzZXJjb250ZW50LmNvbSIsImtleSI6ImtleTUiLCJleHAiOjE3MjU0MzE5MDUsIm5iZiI6MTcyNTQzMTYwNSwicGF0aCI6Ii8xNjA0NjA5My8zNjQyNDMwNTAtN2FkMTMwMTctOGNkNi00ZjkxLTk2YzQtODZjOTU1NmNmMWQ5LnBuZz9YLUFtei1BbGdvcml0aG09QVdTNC1ITUFDLVNIQTI1NiZYLUFtei1DcmVkZW50aWFsPUFLSUFWQ09EWUxTQTUzUFFLNFpBJTJGMjAyNDA5MDQlMkZ1cy1lYXN0LTElMkZzMyUyRmF3czRfcmVxdWVzdCZYLUFtei1EYXRlPTIwMjQwOTA0VDA2MzMyNVomWC1BbXotRXhwaXJlcz0zMDAmWC1BbXotU2lnbmF0dXJlPTQ4MzEyNjNkY2FjZDc5MWYzMWRlODczMzgyN2VmNGM1YmRhYzQzYmVhYWU5ODBmNWQwNTAxOWU4NWIxZjg4ODQmWC1BbXotU2lnbmVkSGVhZGVycz1ob3N0JmFjdG9yX2lkPTAma2V5X2lkPTAmcmVwb19pZD0wIn0.1aqEyURGukfGp5xlwYg05yzGfafnp5PHJl6Any5evVo)
> 
> 我用vlc无法播放



> > 可以播放的，我这个是公网地址，要如何抓包呢，不怎么懂这个 ![Snipaste_2024-09-04_14-01-30](https://private-user-images.githubusercontent.com/16046093/364243050-7ad13017-8cd6-4f91-96c4-86c9556cf1d9.png?jwt=eyJhbGciOiJIUzI1NiIsInR5cCI6IkpXVCJ9.eyJpc3MiOiJnaXRodWIuY29tIiwiYXVkIjoicmF3LmdpdGh1YnVzZXJjb250ZW50LmNvbSIsImtleSI6ImtleTUiLCJleHAiOjE3MjU0MzE5MDUsIm5iZiI6MTcyNTQzMTYwNSwicGF0aCI6Ii8xNjA0NjA5My8zNjQyNDMwNTAtN2FkMTMwMTctOGNkNi00ZjkxLTk2YzQtODZjOTU1NmNmMWQ5LnBuZz9YLUFtei1BbGdvcml0aG09QVdTNC1ITUFDLVNIQTI1NiZYLUFtei1DcmVkZW50aWFsPUFLSUFWQ09EWUxTQTUzUFFLNFpBJTJGMjAyNDA5MDQlMkZ1cy1lYXN0LTElMkZzMyUyRmF3czRfcmVxdWVzdCZYLUFtei1EYXRlPTIwMjQwOTA0VDA2MzMyNVomWC1BbXotRXhwaXJlcz0zMDAmWC1BbXotU2lnbmF0dXJlPTQ4MzEyNjNkY2FjZDc5MWYzMWRlODczMzgyN2VmNGM1YmRhYzQzYmVhYWU5ODBmNWQwNTAxOWU4NWIxZjg4ODQmWC1BbXotU2lnbmVkSGVhZGVycz1ob3N0JmFjdG9yX2lkPTAma2V5X2lkPTAmcmVwb19pZD0wIn0.1aqEyURGukfGp5xlwYg05yzGfafnp5PHJl6Any5evVo)
> 
> 我用vlc无法播放

大佬抱歉，刚查了下海康定义的这个地址有效期只有5分钟，不过不中断就可以一直播，我这边vlc没有中断，所以以为还可以，刚刚我重新获取了一个
rtmp://61.146.129.175:1935/live/openUrl/OWN34E8

**Comment by xiongguangjie** [comment]
> > 你这个是rtmp服务器主动关闭的，vlc 能够播放吗？？？你抓包看看吧
> 
> > > 可以播放的，我这个是公网地址，要如何抓包呢，不怎么懂这个 ![Snipaste_2024-09-04_14-01-30](https://private-user-images.githubusercontent.com/16046093/364243050-7ad13017-8cd6-4f91-96c4-86c9556cf1d9.png?jwt=eyJhbGciOiJIUzI1NiIsInR5cCI6IkpXVCJ9.eyJpc3MiOiJnaXRodWIuY29tIiwiYXVkIjoicmF3LmdpdGh1YnVzZXJjb250ZW50LmNvbSIsImtleSI6ImtleTUiLCJleHAiOjE3MjU0MzE5MDUsIm5iZiI6MTcyNTQzMTYwNSwicGF0aCI6Ii8xNjA0NjA5My8zNjQyNDMwNTAtN2FkMTMwMTctOGNkNi00ZjkxLTk2YzQtODZjOTU1NmNmMWQ5LnBuZz9YLUFtei1BbGdvcml0aG09QVdTNC1ITUFDLVNIQTI1NiZYLUFtei1DcmVkZW50aWFsPUFLSUFWQ09EWUxTQTUzUFFLNFpBJTJGMjAyNDA5MDQlMkZ1cy1lYXN0LTElMkZzMyUyRmF3czRfcmVxdWVzdCZYLUFtei1EYXRlPTIwMjQwOTA0VDA2MzMyNVomWC1BbXotRXhwaXJlcz0zMDAmWC1BbXotU2lnbmF0dXJlPTQ4MzEyNjNkY2FjZDc5MWYzMWRlODczMzgyN2VmNGM1YmRhYzQzYmVhYWU5ODBmNWQwNTAxOWU4NWIxZjg4ODQmWC1BbXotU2lnbmVkSGVhZGVycz1ob3N0JmFjdG9yX2lkPTAma2V5X2lkPTAmcmVwb19pZD0wIn0.1aqEyURGukfGp5xlwYg05yzGfafnp5PHJl6Any5evVo)
> > 
> > 
> > 我用vlc无法播放
> 
> 大佬抱歉，刚查了下海康定义的这个地址有效期只有5分钟，不过不中断就可以一直播，我这边vlc没有中断，所以以为还可以，刚刚我重新获取了一个 rtmp://61.146.129.175:1935/live/openUrl/zKgxXj2 15.19更新地址，大佬您方便的时候回复一句可好，我马上抓新的地址出来，我一直在刷新
> 
> 刚刚试了下issue列表里的这个版本也是相同情况，所以这个问题因该和我编译的无关 git hash: b22cac85bda02472604ff74a182904a75c9339b 编译日期: 2024-08-29

你在服务器抓包把，然后我分析下，这个一般是服务器主动断开的，这个5分钟的有效时间没法调试

**Comment by jimbocn** [comment]
> > > 你这个是rtmp服务器主动关闭的，vlc 能够播放吗？？？你抓包看看吧
> > 
> > 
> > > > 可以播放的，我这个是公网地址，要如何抓包呢，不怎么懂这个 ![Snipaste_2024-09-04_14-01-30](https://private-user-images.githubusercontent.com/16046093/364243050-7ad13017-8cd6-4f91-96c4-86c9556cf1d9.png?jwt=eyJhbGciOiJIUzI1NiIsInR5cCI6IkpXVCJ9.eyJpc3MiOiJnaXRodWIuY29tIiwiYXVkIjoicmF3LmdpdGh1YnVzZXJjb250ZW50LmNvbSIsImtleSI6ImtleTUiLCJleHAiOjE3MjU0MzE5MDUsIm5iZiI6MTcyNTQzMTYwNSwicGF0aCI6Ii8xNjA0NjA5My8zNjQyNDMwNTAtN2FkMTMwMTctOGNkNi00ZjkxLTk2YzQtODZjOTU1NmNmMWQ5LnBuZz9YLUFtei1BbGdvcml0aG09QVdTNC1ITUFDLVNIQTI1NiZYLUFtei1DcmVkZW50aWFsPUFLSUFWQ09EWUxTQTUzUFFLNFpBJTJGMjAyNDA5MDQlMkZ1cy1lYXN0LTElMkZzMyUyRmF3czRfcmVxdWVzdCZYLUFtei1EYXRlPTIwMjQwOTA0VDA2MzMyNVomWC1BbXotRXhwaXJlcz0zMDAmWC1BbXotU2lnbmF0dXJlPTQ4MzEyNjNkY2FjZDc5MWYzMWRlODczMzgyN2VmNGM1YmRhYzQzYmVhYWU5ODBmNWQwNTAxOWU4NWIxZjg4ODQmWC1BbXotU2lnbmVkSGVhZGVycz1ob3N0JmFjdG9yX2lkPTAma2V5X2lkPTAmcmVwb19pZD0wIn0.1aqEyURGukfGp5xlwYg05yzGfafnp5PHJl6Any5evVo)
> > > 
> > > 
> > > 我用vlc无法播放
> > 
> > 
> > 大佬抱歉，刚查了下海康定义的这个地址有效期只有5分钟，不过不中断就可以一直播，我这边vlc没有中断，所以以为还可以，刚刚我重新获取了一个 rtmp://61.146.129.175:1935/live/openUrl/zKgxXj2 15.19更新地址，大佬您方便的时候回复一句可好，我马上抓新的地址出来，我一直在刷新
> > 刚刚试了下issue列表里的这个版本也是相同情况，所以这个问题因该和我编译的无关 git hash: b22cac85bda02472604ff74a182904a75c9339b 编译日期: 2024-08-29
> 
> 你在服务器抓包把，然后我分析下，这个一般是服务器主动断开的，这个5分钟的有效时间没法调试

好的，那我研究下抓包，感谢大佬

**Comment by jimbocn** [comment]
> > > 你这个是rtmp服务器主动关闭的，vlc 能够播放吗？？？你抓包看看吧
> > 
> > 
> > > > 可以播放的，我这个是公网地址，要如何抓包呢，不怎么懂这个 ![Snipaste_2024-09-04_14-01-30](https://private-user-images.githubusercontent.com/16046093/364243050-7ad13017-8cd6-4f91-96c4-86c9556cf1d9.png?jwt=eyJhbGciOiJIUzI1NiIsInR5cCI6IkpXVCJ9.eyJpc3MiOiJnaXRodWIuY29tIiwiYXVkIjoicmF3LmdpdGh1YnVzZXJjb250ZW50LmNvbSIsImtleSI6ImtleTUiLCJleHAiOjE3MjU0MzE5MDUsIm5iZiI6MTcyNTQzMTYwNSwicGF0aCI6Ii8xNjA0NjA5My8zNjQyNDMwNTAtN2FkMTMwMTctOGNkNi00ZjkxLTk2YzQtODZjOTU1NmNmMWQ5LnBuZz9YLUFtei1BbGdvcml0aG09QVdTNC1ITUFDLVNIQTI1NiZYLUFtei1DcmVkZW50aWFsPUFLSUFWQ09EWUxTQTUzUFFLNFpBJTJGMjAyNDA5MDQlMkZ1cy1lYXN0LTElMkZzMyUyRmF3czRfcmVxdWVzdCZYLUFtei1EYXRlPTIwMjQwOTA0VDA2MzMyNVomWC1BbXotRXhwaXJlcz0zMDAmWC1BbXotU2lnbmF0dXJlPTQ4MzEyNjNkY2FjZDc5MWYzMWRlODczMzgyN2VmNGM1YmRhYzQzYmVhYWU5ODBmNWQwNTAxOWU4NWIxZjg4ODQmWC1BbXotU2lnbmVkSGVhZGVycz1ob3N0JmFjdG9yX2lkPTAma2V5X2lkPTAmcmVwb19pZD0wIn0.1aqEyURGukfGp5xlwYg05yzGfafnp5PHJl6Any5evVo)
> > > 
> > > 
> > > 我用vlc无法播放
> > 
> > 
> > 大佬抱歉，刚查了下海康定义的这个地址有效期只有5分钟，不过不中断就可以一直播，我这边vlc没有中断，所以以为还可以，刚刚我重新获取了一个 rtmp://61.146.129.175:1935/live/openUrl/zKgxXj2 15.19更新地址，大佬您方便的时候回复一句可好，我马上抓新的地址出来，我一直在刷新
> > 刚刚试了下issue列表里的这个版本也是相同情况，所以这个问题因该和我编译的无关 git hash: b22cac85bda02472604ff74a182904a75c9339b 编译日期: 2024-08-29
> 
> 你在服务器抓包把，然后我分析下，这个一般是服务器主动断开的，这个5分钟的有效时间没法调试

我是

> > > 你这个是rtmp服务器主动关闭的，vlc 能够播放吗？？？你抓包看看吧
> > 
> > 
> > > > 可以播放的，我这个是公网地址，要如何抓包呢，不怎么懂这个 ![Snipaste_2024-09-04_14-01-30](https://private-user-images.githubusercontent.com/16046093/364243050-7ad13017-8cd6-4f91-96c4-86c9556cf1d9.png?jwt=eyJhbGciOiJIUzI1NiIsInR5cCI6IkpXVCJ9.eyJpc3MiOiJnaXRodWIuY29tIiwiYXVkIjoicmF3LmdpdGh1YnVzZXJjb250ZW50LmNvbSIsImtleSI6ImtleTUiLCJleHAiOjE3MjU0MzE5MDUsIm5iZiI6MTcyNTQzMTYwNSwicGF0aCI6Ii8xNjA0NjA5My8zNjQyNDMwNTAtN2FkMTMwMTctOGNkNi00ZjkxLTk2YzQtODZjOTU1NmNmMWQ5LnBuZz9YLUFtei1BbGdvcml0aG09QVdTNC1ITUFDLVNIQTI1NiZYLUFtei1DcmVkZW50aWFsPUFLSUFWQ09EWUxTQTUzUFFLNFpBJTJGMjAyNDA5MDQlMkZ1cy1lYXN0LTElMkZzMyUyRmF3czRfcmVxdWVzdCZYLUFtei1EYXRlPTIwMjQwOTA0VDA2MzMyNVomWC1BbXotRXhwaXJlcz0zMDAmWC1BbXotU2lnbmF0dXJlPTQ4MzEyNjNkY2FjZDc5MWYzMWRlODczMzgyN2VmNGM1YmRhYzQzYmVhYWU5ODBmNWQwNTAxOWU4NWIxZjg4ODQmWC1BbXotU2lnbmVkSGVhZGVycz1ob3N0JmFjdG9yX2lkPTAma2V5X2lkPTAmcmVwb19pZD0wIn0.1aqEyURGukfGp5xlwYg05yzGfafnp5PHJl6Any5evVo)
> > > 
> > > 
> > > 我用vlc无法播放
> > 
> > 
> > 大佬抱歉，刚查了下海康定义的这个地址有效期只有5分钟，不过不中断就可以一直播，我这边vlc没有中断，所以以为还可以，刚刚我重新获取了一个 rtmp://61.146.129.175:1935/live/openUrl/zKgxXj2 15.19更新地址，大佬您方便的时候回复一句可好，我马上抓新的地址出来，我一直在刷新
> > 刚刚试了下issue列表里的这个版本也是相同情况，所以这个问题因该和我编译的无关 git hash: b22cac85bda02472604ff74a182904a75c9339b 编译日期: 2024-08-29
> 
> 你在服务器抓包把，然后我分析下，这个一般是服务器主动断开的，这个5分钟的有效时间没法调试

[abcd.zip](https://github.com/user-attachments/files/16868245/abcd.zip)
因为目前不会过滤，抓的可能有点多，辛苦大佬查看了，我是这样抓的，拿到一个新的rtmp地址，打开抓包，调用addStreamProxy接口等待返回end of file后停止抓包，然后再用vlc播放器播放成功，确保刚刚用rtmp的地址是未失效的

**Comment by xiongguangjie** [comment]
> 因为目前不会过滤，抓的可能有点多，辛苦大佬查看了，我是这样抓的，拿到一个新的rtmp地址，打开抓包，调用addStreamProxy接口等待返回end of file后停止抓包，然后再用vlc播放器播放成功，确保刚刚用rtmp的地址是未失效的

我看zlm的抓包，发现你这个tcp怎么好多重复的包与重传，我感觉你这个网络有问题，vlc的那个链接基本上没有网络问题。

**Comment by jimbocn** [comment]
> > 因为目前不会过滤，抓的可能有点多，辛苦大佬查看了，我是这样抓的，拿到一个新的rtmp地址，打开抓包，调用addStreamProxy接口等待返回end of file后停止抓包，然后再用vlc播放器播放成功，确保刚刚用rtmp的地址是未失效的
> 
> 我看zlm的抓包，发现你这个tcp怎么好多重复的包与重传，我感觉你这个网络有问题，vlc的那个链接基本上没有网络问题。

额，网络这块不怎么懂，那我现在不知道如何排查了，目前用了两台服务器测试都是相同结果，然后同时拉rtsp又可以

**Comment by jimbocn** [comment]
> > 因为目前不会过滤，抓的可能有点多，辛苦大佬查看了，我是这样抓的，拿到一个新的rtmp地址，打开抓包，调用addStreamProxy接口等待返回end of file后停止抓包，然后再用vlc播放器播放成功，确保刚刚用rtmp的地址是未失效的
> 
> 我看zlm的抓包，发现你这个tcp怎么好多重复的包与重传，我感觉你这个网络有问题，vlc的那个链接基本上没有网络问题。

大佬，我又重新测试下，测试情况是zml,vlc,抓包软件都在同一台电脑，下面是同一个rmtp地址的抓包情况
[zml.zip](https://github.com/user-attachments/files/16872902/zml.zip)
[vlc.zip](https://github.com/user-attachments/files/16872905/vlc.zip)
![Snipaste_2024-09-04_23-06-24](https://github.com/user-attachments/assets/15f5f365-d275-44cc-91d5-361fa9e9b994)
![Snipaste_2024-09-04_23-07-13](https://github.com/user-attachments/assets/045cd7fd-4b9f-4143-a664-dbe52ce681b1)
在用zml的时候貌似抓包的比vlc的少了Window Acknowledgement Size 2500000

**Comment by xiongguangjie** [comment]
> > > 因为目前不会过滤，抓的可能有点多，辛苦大佬查看了，我是这样抓的，拿到一个新的rtmp地址，打开抓包，调用addStreamProxy接口等待返回end of file后停止抓包，然后再用vlc播放器播放成功，确保刚刚用rtmp的地址是未失效的
> > 
> > 
> > 我看zlm的抓包，发现你这个tcp怎么好多重复的包与重传，我感觉你这个网络有问题，vlc的那个链接基本上没有网络问题。
> 
> 大佬，我又重新测试下，测试情况是zml,vlc,抓包软件都在同一台电脑，下面是同一个rmtp地址的抓包情况 [zml.zip](https://github.com/user-attachments/files/16872902/zml.zip) [vlc.zip](https://github.com/user-attachments/files/16872905/vlc.zip) ![Snipaste_2024-09-04_23-06-24](https://private-user-images.githubusercontent.com/16046093/364435812-15f5f365-d275-44cc-91d5-361fa9e9b994.png?jwt=eyJhbGciOiJIUzI1NiIsInR5cCI6IkpXVCJ9.eyJpc3MiOiJnaXRodWIuY29tIiwiYXVkIjoicmF3LmdpdGh1YnVzZXJjb250ZW50LmNvbSIsImtleSI6ImtleTUiLCJleHAiOjE3MjU1MDg0MzYsIm5iZiI6MTcyNTUwODEzNiwicGF0aCI6Ii8xNjA0NjA5My8zNjQ0MzU4MTItMTVmNWYzNjUtZDI3NS00NGNjLTkxZDUtMzYxZmE5ZTliOTk0LnBuZz9YLUFtei1BbGdvcml0aG09QVdTNC1ITUFDLVNIQTI1NiZYLUFtei1DcmVkZW50aWFsPUFLSUFWQ09EWUxTQTUzUFFLNFpBJTJGMjAyNDA5MDUlMkZ1cy1lYXN0LTElMkZzMyUyRmF3czRfcmVxdWVzdCZYLUFtei1EYXRlPTIwMjQwOTA1VDAzNDg1NlomWC1BbXotRXhwaXJlcz0zMDAmWC1BbXotU2lnbmF0dXJlPTY1OWFiMTBmNzAwNDZjMzYyNTBkN2Y0OGQ4MzM4NGFmNDFkMWY5YTlmNWU0NjU1ZWM0YjEwYTcxODgyMGI1ZDImWC1BbXotU2lnbmVkSGVhZGVycz1ob3N0JmFjdG9yX2lkPTAma2V5X2lkPTAmcmVwb19pZD0wIn0.YblxqtYAzX3FVv2uxwRGtD18BmTCzU68d8ygWimWqUM) ![Snipaste_2024-09-04_23-07-13](https://private-user-images.githubusercontent.com/16046093/364435891-045cd7fd-4b9f-4143-a664-dbe52ce681b1.png?jwt=eyJhbGciOiJIUzI1NiIsInR5cCI6IkpXVCJ9.eyJpc3MiOiJnaXRodWIuY29tIiwiYXVkIjoicmF3LmdpdGh1YnVzZXJjb250ZW50LmNvbSIsImtleSI6ImtleTUiLCJleHAiOjE3MjU1MDg0MzYsIm5iZiI6MTcyNTUwODEzNiwicGF0aCI6Ii8xNjA0NjA5My8zNjQ0MzU4OTEtMDQ1Y2Q3ZmQtNGI5Zi00MTQzLWE2NjQtZGJlNTJjZTY4MWIxLnBuZz9YLUFtei1BbGdvcml0aG09QVdTNC1ITUFDLVNIQTI1NiZYLUFtei1DcmVkZW50aWFsPUFLSUFWQ09EWUxTQTUzUFFLNFpBJTJGMjAyNDA5MDUlMkZ1cy1lYXN0LTElMkZzMyUyRmF3czRfcmVxdWVzdCZYLUFtei1EYXRlPTIwMjQwOTA1VDAzNDg1NlomWC1BbXotRXhwaXJlcz0zMDAmWC1BbXotU2lnbmF0dXJlPTBiMmY0MDA4YjUwMTc0ZTNiYWU2NGI3MTg2M2NkYjRlMWE4ZWE5NTVhMmNmNDkwMTZmMzQ2ZTA2ODYwODFiYzkmWC1BbXotU2lnbmVkSGVhZGVycz1ob3N0JmFjdG9yX2lkPTAma2V5X2lkPTAmcmVwb19pZD0wIn0.G8oou2WgC7w_yIJ4zyqzeLLivoXCUPRTwpQFz50FJ2c) 在用zml的时候貌似抓包的比vlc的少了Window Acknowledgement Size 2500000

```diff --git a/src/Rtmp/RtmpProtocol.cpp b/src/Rtmp/RtmpProtocol.cpp
index 010e30d4..e8bbab74 100644
--- a/src/Rtmp/RtmpProtocol.cpp
+++ b/src/Rtmp/RtmpProtocol.cpp
@@ -528,7 +528,7 @@ void RtmpProtocol::send_complex_S0S1S2(int schemeType,const string &digest){
 //发送复杂握手c0c1
 void RtmpHandshake::create_complex_c0c1() {
 #ifdef ENABLE_OPENSSL
-    memcpy(zero, "\x80\x00\x07\x02", 4);
+    memcpy(zero, "\x09\x00\x7c\x02", 4);
     //digest随机偏移长度
     auto offset_value = rand() % (C1_SCHEMA_SIZE - C1_OFFSET_SIZE - C1_DIGEST_SIZE);
     //设置digest偏移长度```
你是要这个patch 重新编译试一下，感觉是版本的问题

**Comment by jimbocn** [comment]
> > > > 因为目前不会过滤，抓的可能有点多，辛苦大佬查看了，我是这样抓的，拿到一个新的rtmp地址，打开抓包，调用addStreamProxy接口等待返回end of file后停止抓包，然后再用vlc播放器播放成功，确保刚刚用rtmp的地址是未失效的
> > > 
> > > 
> > > 我看zlm的抓包，发现你这个tcp怎么好多重复的包与重传，我感觉你这个网络有问题，vlc的那个链接基本上没有网络问题。
> > 
> > 
> > 大佬，我又重新测试下，测试情况是zml,vlc,抓包软件都在同一台电脑，下面是同一个rmtp地址的抓包情况 [zml.zip](https://github.com/user-attachments/files/16872902/zml.zip) [vlc.zip](https://github.com/user-attachments/files/16872905/vlc.zip) ![Snipaste_2024-09-04_23-06-24](https://private-user-images.githubusercontent.com/16046093/364435812-15f5f365-d275-44cc-91d5-361fa9e9b994.png?jwt=eyJhbGciOiJIUzI1NiIsInR5cCI6IkpXVCJ9.eyJpc3MiOiJnaXRodWIuY29tIiwiYXVkIjoicmF3LmdpdGh1YnVzZXJjb250ZW50LmNvbSIsImtleSI6ImtleTUiLCJleHAiOjE3MjU1MDg0MzYsIm5iZiI6MTcyNTUwODEzNiwicGF0aCI6Ii8xNjA0NjA5My8zNjQ0MzU4MTItMTVmNWYzNjUtZDI3NS00NGNjLTkxZDUtMzYxZmE5ZTliOTk0LnBuZz9YLUFtei1BbGdvcml0aG09QVdTNC1ITUFDLVNIQTI1NiZYLUFtei1DcmVkZW50aWFsPUFLSUFWQ09EWUxTQTUzUFFLNFpBJTJGMjAyNDA5MDUlMkZ1cy1lYXN0LTElMkZzMyUyRmF3czRfcmVxdWVzdCZYLUFtei1EYXRlPTIwMjQwOTA1VDAzNDg1NlomWC1BbXotRXhwaXJlcz0zMDAmWC1BbXotU2lnbmF0dXJlPTY1OWFiMTBmNzAwNDZjMzYyNTBkN2Y0OGQ4MzM4NGFmNDFkMWY5YTlmNWU0NjU1ZWM0YjEwYTcxODgyMGI1ZDImWC1BbXotU2lnbmVkSGVhZGVycz1ob3N0JmFjdG9yX2lkPTAma2V5X2lkPTAmcmVwb19pZD0wIn0.YblxqtYAzX3FVv2uxwRGtD18BmTCzU68d8ygWimWqUM) ![Snipaste_2024-09-04_23-07-13](https://private-user-images.githubusercontent.com/16046093/364435891-045cd7fd-4b9f-4143-a664-dbe52ce681b1.png?jwt=eyJhbGciOiJIUzI1NiIsInR5cCI6IkpXVCJ9.eyJpc3MiOiJnaXRodWIuY29tIiwiYXVkIjoicmF3LmdpdGh1YnVzZXJjb250ZW50LmNvbSIsImtleSI6ImtleTUiLCJleHAiOjE3MjU1MDg0MzYsIm5iZiI6MTcyNTUwODEzNiwicGF0aCI6Ii8xNjA0NjA5My8zNjQ0MzU4OTEtMDQ1Y2Q3ZmQtNGI5Zi00MTQzLWE2NjQtZGJlNTJjZTY4MWIxLnBuZz9YLUFtei1BbGdvcml0aG09QVdTNC1ITUFDLVNIQTI1NiZYLUFtei1DcmVkZW50aWFsPUFLSUFWQ09EWUxTQTUzUFFLNFpBJTJGMjAyNDA5MDUlMkZ1cy1lYXN0LTElMkZzMyUyRmF3czRfcmVxdWVzdCZYLUFtei1EYXRlPTIwMjQwOTA1VDAzNDg1NlomWC1BbXotRXhwaXJlcz0zMDAmWC1BbXotU2lnbmF0dXJlPTBiMmY0MDA4YjUwMTc0ZTNiYWU2NGI3MTg2M2NkYjRlMWE4ZWE5NTVhMmNmNDkwMTZmMzQ2ZTA2ODYwODFiYzkmWC1BbXotU2lnbmVkSGVhZGVycz1ob3N0JmFjdG9yX2lkPTAma2V5X2lkPTAmcmVwb19pZD0wIn0.G8oou2WgC7w_yIJ4zyqzeLLivoXCUPRTwpQFz50FJ2c) 在用zml的时候貌似抓包的比vlc的少了Window Acknowledgement Size 2500000
> 
> ```diff
> index 010e30d4..e8bbab74 100644
> --- a/src/Rtmp/RtmpProtocol.cpp
> +++ b/src/Rtmp/RtmpProtocol.cpp
> @@ -528,7 +528,7 @@ void RtmpProtocol::send_complex_S0S1S2(int schemeType,const string &digest){
>  //发送复杂握手c0c1
>  void RtmpHandshake::create_complex_c0c1() {
>  #ifdef ENABLE_OPENSSL
> -    memcpy(zero, "\x80\x00\x07\x02", 4);
> +    memcpy(zero, "\x09\x00\x7c\x02", 4);
>      //digest随机偏移长度
>      auto offset_value = rand() % (C1_SCHEMA_SIZE - C1_OFFSET_SIZE - C1_DIGEST_SIZE);
>      //设置digest偏移长度```
> 你是要这个patch 重新编译试一下，感觉是版本的问题
> ```

是改这一行吗，我下载最新源码修改这一行后编译，重新运行问题依旧存在
![Snipaste_2024-09-05_12-46-47](https://github.com/user-attachments/assets/c5764dd5-deb9-4778-986a-2353c58e8b3d)

**Comment by xiongguangjie** [comment]
> > > > > 因为目前不会过滤，抓的可能有点多，辛苦大佬查看了，我是这样抓的，拿到一个新的rtmp地址，打开抓包，调用addStreamProxy接口等待返回end of file后停止抓包，然后再用vlc播放器播放成功，确保刚刚用rtmp的地址是未失效的
> > > > 
> > > > 
> > > > 我看zlm的抓包，发现你这个tcp怎么好多重复的包与重传，我感觉你这个网络有问题，vlc的那个链接基本上没有网络问题。
> > > 
> > > 
> > > 大佬，我又重新测试下，测试情况是zml,vlc,抓包软件都在同一台电脑，下面是同一个rmtp地址的抓包情况 [zml.zip](https://github.com/user-attachments/files/16872902/zml.zip) [vlc.zip](https://github.com/user-attachments/files/16872905/vlc.zip) ![Snipaste_2024-09-04_23-06-24](https://private-user-images.githubusercontent.com/16046093/364435812-15f5f365-d275-44cc-91d5-361fa9e9b994.png?jwt=eyJhbGciOiJIUzI1NiIsInR5cCI6IkpXVCJ9.eyJpc3MiOiJnaXRodWIuY29tIiwiYXVkIjoicmF3LmdpdGh1YnVzZXJjb250ZW50LmNvbSIsImtleSI6ImtleTUiLCJleHAiOjE3MjU1MDg0MzYsIm5iZiI6MTcyNTUwODEzNiwicGF0aCI6Ii8xNjA0NjA5My8zNjQ0MzU4MTItMTVmNWYzNjUtZDI3NS00NGNjLTkxZDUtMzYxZmE5ZTliOTk0LnBuZz9YLUFtei1BbGdvcml0aG09QVdTNC1ITUFDLVNIQTI1NiZYLUFtei1DcmVkZW50aWFsPUFLSUFWQ09EWUxTQTUzUFFLNFpBJTJGMjAyNDA5MDUlMkZ1cy1lYXN0LTElMkZzMyUyRmF3czRfcmVxdWVzdCZYLUFtei1EYXRlPTIwMjQwOTA1VDAzNDg1NlomWC1BbXotRXhwaXJlcz0zMDAmWC1BbXotU2lnbmF0dXJlPTY1OWFiMTBmNzAwNDZjMzYyNTBkN2Y0OGQ4MzM4NGFmNDFkMWY5YTlmNWU0NjU1ZWM0YjEwYTcxODgyMGI1ZDImWC1BbXotU2lnbmVkSGVhZGVycz1ob3N0JmFjdG9yX2lkPTAma2V5X2lkPTAmcmVwb19pZD0wIn0.YblxqtYAzX3FVv2uxwRGtD18BmTCzU68d8ygWimWqUM) ![Snipaste_2024-09-04_23-07-13](https://private-user-images.githubusercontent.com/16046093/364435891-045cd7fd-4b9f-4143-a664-dbe52ce681b1.png?jwt=eyJhbGciOiJIUzI1NiIsInR5cCI6IkpXVCJ9.eyJpc3MiOiJnaXRodWIuY29tIiwiYXVkIjoicmF3LmdpdGh1YnVzZXJjb250ZW50LmNvbSIsImtleSI6ImtleTUiLCJleHAiOjE3MjU1MDg0MzYsIm5iZiI6MTcyNTUwODEzNiwicGF0aCI6Ii8xNjA0NjA5My8zNjQ0MzU4OTEtMDQ1Y2Q3ZmQtNGI5Zi00MTQzLWE2NjQtZGJlNTJjZTY4MWIxLnBuZz9YLUFtei1BbGdvcml0aG09QVdTNC1ITUFDLVNIQTI1NiZYLUFtei1DcmVkZW50aWFsPUFLSUFWQ09EWUxTQTUzUFFLNFpBJTJGMjAyNDA5MDUlMkZ1cy1lYXN0LTElMkZzMyUyRmF3czRfcmVxdWVzdCZYLUFtei1EYXRlPTIwMjQwOTA1VDAzNDg1NlomWC1BbXotRXhwaXJlcz0zMDAmWC1BbXotU2lnbmF0dXJlPTBiMmY0MDA4YjUwMTc0ZTNiYWU2NGI3MTg2M2NkYjRlMWE4ZWE5NTVhMmNmNDkwMTZmMzQ2ZTA2ODYwODFiYzkmWC1BbXotU2lnbmVkSGVhZGVycz1ob3N0JmFjdG9yX2lkPTAma2V5X2lkPTAmcmVwb19pZD0wIn0.G8oou2WgC7w_yIJ4zyqzeLLivoXCUPRTwpQFz50FJ2c) 在用zml的时候貌似抓包的比vlc的少了Window Acknowledgement Size 2500000
> > 
> > 
> > ```diff
> > index 010e30d4..e8bbab74 100644
> > --- a/src/Rtmp/RtmpProtocol.cpp
> > +++ b/src/Rtmp/RtmpProtocol.cpp
> > @@ -528,7 +528,7 @@ void RtmpProtocol::send_complex_S0S1S2(int schemeType,const string &digest){
> >  //发送复杂握手c0c1
> >  void RtmpHandshake::create_complex_c0c1() {
> >  #ifdef ENABLE_OPENSSL
> > -    memcpy(zero, "\x80\x00\x07\x02", 4);
> > +    memcpy(zero, "\x09\x00\x7c\x02", 4);
> >      //digest随机偏移长度
> >      auto offset_value = rand() % (C1_SCHEMA_SIZE - C1_OFFSET_SIZE - C1_DIGEST_SIZE);
> >      //设置digest偏移长度```
> > 你是要这个patch 重新编译试一下，感觉是版本的问题
> > ```
> 
> 是改这一行吗，我下载最新源码修改这一行后编译，重新运行问题依旧存在 ![Snipaste_2024-09-05_12-46-47](https://private-user-images.githubusercontent.com/16046093/364627459-c5764dd5-deb9-4778-986a-2353c58e8b3d.png?jwt=eyJhbGciOiJIUzI1NiIsInR5cCI6IkpXVCJ9.eyJpc3MiOiJnaXRodWIuY29tIiwiYXVkIjoicmF3LmdpdGh1YnVzZXJjb250ZW50LmNvbSIsImtleSI6ImtleTUiLCJleHAiOjE3MjU1MTUwNDAsIm5iZiI6MTcyNTUxNDc0MCwicGF0aCI6Ii8xNjA0NjA5My8zNjQ2Mjc0NTktYzU3NjRkZDUtZGViOS00Nzc4LTk4NmEtMjM1M2M1OGU4YjNkLnBuZz9YLUFtei1BbGdvcml0aG09QVdTNC1ITUFDLVNIQTI1NiZYLUFtei1DcmVkZW50aWFsPUFLSUFWQ09EWUxTQTUzUFFLNFpBJTJGMjAyNDA5MDUlMkZ1cy1lYXN0LTElMkZzMyUyRmF3czRfcmVxdWVzdCZYLUFtei1EYXRlPTIwMjQwOTA1VDA1MzkwMFomWC1BbXotRXhwaXJlcz0zMDAmWC1BbXotU2lnbmF0dXJlPTBmYTgxNWQxNzNlZThjMTc2ZDc3YjE2Yzk2NzZlY2NkNmI1NzUxNjg3ZmZhMzcwNDg5OTAxMmYxNWVmMzY0OTEmWC1BbXotU2lnbmVkSGVhZGVycz1ob3N0JmFjdG9yX2lkPTAma2V5X2lkPTAmcmVwb19pZD0wIn0.Ef0KrWYNZiBJJMZwJGAhuUX4BTBMro0SSrWeuobCE4I)

```diff --git a/src/Rtmp/RtmpPlayer.cpp b/src/Rtmp/RtmpPlayer.cpp
index abc45387..c5c348e2 100644
--- a/src/Rtmp/RtmpPlayer.cpp
+++ b/src/Rtmp/RtmpPlayer.cpp
@@ -197,7 +197,7 @@ void RtmpPlayer::send_connect() {
     fourCcList.add("av01");
     fourCcList.add("vp09");
     fourCcList.add("hvc1");
-    obj.set("fourCcList", fourCcList);
+    //obj.set("fourCcList", fourCcList);
 
     sendInvoke("connect", obj);
     addOnResultCB([this](AMFDecoder &dec) {```

这么改试一下，看是否可以解决

**Comment by jimbocn** [comment]
> ```diff
> send_connect
> ```

感谢大佬，不过注释obj.set("fourCcList", fourCcList);后从新编译运行依旧不行，这是最新的抓包
40 2.933666184 192.168.1.120 -> 61.146.129.175 TCP 74 lmsocialserver > macromedia-fcs [SYN] Seq=0 Win=29200 Len=0 MSS=1460 SACK_PERM=1 TSval=2003026356 TSecr=0 WS=8
 41 2.948544821 61.146.129.175 -> 192.168.1.120 TCP 66 macromedia-fcs > lmsocialserver [SYN, ACK] Seq=0 Ack=1 Win=43690 Len=0 MSS=1400 SACK_PERM=1 WS=128
 42 2.948583680 192.168.1.120 -> 61.146.129.175 TCP 54 lmsocialserver > macromedia-fcs [ACK] Seq=1 Ack=1 Win=29200 Len=0
 43 2.948710858 192.168.1.120 -> 61.146.129.175 TCP 55 lmsocialserver > macromedia-fcs [PSH, ACK] Seq=1 Ack=1 Win=29200 Len=1
 44 2.948772210 192.168.1.120 -> 61.146.129.175 TCP 1454 lmsocialserver > macromedia-fcs [ACK] Seq=2 Ack=1 Win=29200 Len=1400
 45 2.948798619 192.168.1.120 -> 61.146.129.175 RTMP 190 Handshake C0+C1
 46 2.963267292 61.146.129.175 -> 192.168.1.120 TCP 66 [TCP Window Update] macromedia-fcs > lmsocialserver [ACK] Seq=1 Ack=1 Win=46592 Len=0 SLE=2 SRE=1402
 47 2.963288364 61.146.129.175 -> 192.168.1.120 TCP 60 macromedia-fcs > lmsocialserver [ACK] Seq=1 Ack=1402 Win=46592 Len=0
 48 2.963312052 61.146.129.175 -> 192.168.1.120 TCP 60 macromedia-fcs > lmsocialserver [ACK] Seq=1 Ack=1538 Win=47616 Len=0
 50 2.972564042 61.146.129.175 -> 192.168.1.120 TCP 1454 macromedia-fcs > lmsocialserver [ACK] Seq=1 Ack=1538 Win=47616 Len=1400
 51 2.972574201 192.168.1.120 -> 61.146.129.175 TCP 54 lmsocialserver > macromedia-fcs [ACK] Seq=1538 Ack=1401 Win=32120 Len=0
 52 2.974272645 61.146.129.175 -> 192.168.1.120 TCP 1651 macromedia-fcs > lmsocialserver [PSH, ACK] Seq=1401 Ack=1538 Win=47616 Len=1597
 53 2.974282294 192.168.1.120 -> 61.146.129.175 TCP 54 lmsocialserver > macromedia-fcs [ACK] Seq=1538 Ack=2998 Win=35320 Len=0
 55 2.987869087 61.146.129.175 -> 192.168.1.120 RTMP 130 Handshake S0+S1+S2
 56 2.987878234 192.168.1.120 -> 61.146.129.175 TCP 54 lmsocialserver > macromedia-fcs [ACK] Seq=1538 Ack=3074 Win=35320 Len=0
 57 2.987929308 192.168.1.120 -> 61.146.129.175 TCP 1454 lmsocialserver > macromedia-fcs [ACK] Seq=1538 Ack=3074 Win=35320 Len=1400
 58 2.987976645 192.168.1.120 -> 61.146.129.175 RTMP 394 Handshake C2 | connect('live/openUrl')
 59 3.001298048 61.146.129.175 -> 192.168.1.120 TCP 60 macromedia-fcs > lmsocialserver [ACK] Seq=3074 Ack=3278 Win=53248 Len=0
180 21.245580646 61.146.129.175 -> 192.168.1.120 TCP 60 macromedia-fcs > lmsocialserver [FIN, ACK] Seq=3074 Ack=3278 Win=53248 Len=0
183 21.245946249 192.168.1.120 -> 61.146.129.175 TCP 54 lmsocialserver > macromedia-fcs [FIN, ACK] Seq=3278 Ack=3075 Win=35320 Len=0
192 21.266419031 61.146.129.175 -> 192.168.1.120 TCP 60 macromedia-fcs > lmsocialserver [ACK] Seq=3075 Ack=3279 Win=53248 Len=0

**Comment by xiongguangjie** [comment]
> macromedia

你把抓包上传上来呀，这个没法看

**Comment by jimbocn** [comment]
> > macromedia
> 
> 你把抓包上传上来呀，这个没法看

[capture.zip](https://github.com/user-attachments/files/16885340/capture.zip)

**Comment by xiongguangjie** [comment]
> > > macromedia
> > 
> > 
> > 你把抓包上传上来呀，这个没法看
> 
> [capture.zip](https://github.com/user-attachments/files/16885340/capture.zip)

```diff --git a/src/Rtmp/RtmpPlayer.cpp b/src/Rtmp/RtmpPlayer.cpp
index abc45387..2ac5259e 100644
--- a/src/Rtmp/RtmpPlayer.cpp
+++ b/src/Rtmp/RtmpPlayer.cpp
@@ -189,9 +189,9 @@ void RtmpPlayer::send_connect() {
     //SUPPORT_VID_CLIENT_SEEK 支持seek
     obj.set("videoFunction", 1);
     //只支持aac
-    obj.set("audioCodecs", (double) (0x0400));
+    obj.set("audioCodecs", (double) (4071));
     //只支持H264
-    obj.set("videoCodecs", (double) (0x0080));
+    obj.set("videoCodecs", (double) (252));
 
     AMFValue fourCcList(AMF_STRICT_ARRAY);
     fourCcList.add("av01");```
试一下

**Comment by jimbocn** [comment]
> ```diff
> 0x0400
> ```

[capture.zip](https://github.com/user-attachments/files/16885752/capture.zip)
问题依旧存在

**Comment by xiongguangjie** [comment]
> > ```diff
> > 0x0400
> > ```
> 
> [capture.zip](https://github.com/user-attachments/files/16885752/capture.zip) 问题依旧存在

你这个我麻了，你找服务器端，问问他们是咋回事为何不能拉流，谁需要哪些要求还是怎么回事？或者你给个url长期有效的我去调试去拉

**Comment by jimbocn** [comment]
> > > ```diff
> > > 0x0400
> > > ```
> > 
> > 
> > [capture.zip](https://github.com/user-attachments/files/16885752/capture.zip) 问题依旧存在
> 
> 你这个我麻了，你找服务器端，问问他们是咋回事为何不能拉流，还需要哪些要求还是怎么回事？或者你给个url长期有效的我去调试去拉

这个咋问，服务端应该服务器部署了海康的综合安防管理平台吧，通过调用api/video/v2/cameras/previewURLs获取的地址，之前用的是go语言写的一个拉流的，目前可以正常拉流观看，但是因为缺少源码，所以我想更新成zml，但是碰到现在这个问题，海康5分钟有效期看了文档好像是不支持修改了。感谢大佬，实在不行就算了吧，我继续用之前的已经编译好go语言的

**Comment by xiongguangjie** [comment]
> > > > ```diff
> > > > 0x0400
> > > > ```
> > > 
> > > 
> > > [capture.zip](https://github.com/user-attachments/files/16885752/capture.zip) 问题依旧存在
> > 
> > 
> > 你这个我麻了，你找服务器端，问问他们是咋回事为何不能拉流，还需要哪些要求还是怎么回事？或者你给个url长期有效的我去调试去拉
> 
> 这个咋问，服务端应该服务器部署了海康的综合安防管理平台吧，通过调用api/video/v2/cameras/previewURLs获取的地址，之前用的是go语言写的一个拉流的，目前可以正常拉流观看，但是因为缺少源码，所以我想更新成zml，但是碰到现在这个问题，海康5分钟有效期看了文档好像是不支持修改了。感谢大佬，实在不行就算了吧，我继续用之前的已经编译好go语言的

应该是支持的类似这个 https://github.com/ZLMediaKit/ZLMediaKit/issues/2007，这个的流格式与你的一样

**Comment by jimbocn** [comment]
> > > > > ```diff
> > > > > 0x0400
> > > > > ```
> > > > 
> > > > 
> > > > [capture.zip](https://github.com/user-attachments/files/16885752/capture.zip) 问题依旧存在
> > > 
> > > 
> > > 你这个我麻了，你找服务器端，问问他们是咋回事为何不能拉流，还需要哪些要求还是怎么回事？或者你给个url长期有效的我去调试去拉
> > 
> > 
> > 这个咋问，服务端应该服务器部署了海康的综合安防管理平台吧，通过调用api/video/v2/cameras/previewURLs获取的地址，之前用的是go语言写的一个拉流的，目前可以正常拉流观看，但是因为缺少源码，所以我想更新成zml，但是碰到现在这个问题，海康5分钟有效期看了文档好像是不支持修改了。感谢大佬，实在不行就算了吧，我继续用之前的已经编译好go语言的
> 
> 应该是支持的类似这个 [https://github.com/ZLMediaKit/ZLMediaKit/issues/2007，这个的流格式与你的一样](https://github.com/ZLMediaKit/ZLMediaKit/issues/2007%EF%BC%8C%E8%BF%99%E4%B8%AA%E7%9A%84%E6%B5%81%E6%A0%BC%E5%BC%8F%E4%B8%8E%E4%BD%A0%E7%9A%84%E4%B8%80%E6%A0%B7)

问了下海康的客服，感觉您发的那个他应该是弄了第三方永久的视频流，我看了下弄这个的条件我目前做不到，需要联系海康售后去现场打补丁

**Comment by jimbocn** [comment]
> ```diff
> flashver 
> ```

辛苦大佬，不过还是不行

**Comment by xiongguangjie** [comment]
> ```diff
> ```diff
> flashver 
> ```
> 
> 
>     
>       
>     
> 
>       
>     
> 
>     
>   
> ```

那就算了吧，这个除非提供相应的长久持续的rtmp源，否则黑盒没法改

**Comment by jimbocn** [comment]
> > ```diff
> > ```diff
> > flashver 
> > ```
> 
> 那就算了吧，这个除非提供相应的长久持续的rtmp源，否则黑盒没法改

好的，感谢了
